<?xml version="1.0" encoding="UTF-8"?>
<biblioteca xmlns:xsi="http://www.w3.org/2001/XMLSchema-instance"
        xsi:noNamespaceSchemaLocation="biblioteca.xsd">   
        <libros>
         <libro id="L1111" Tipo_clase="Novela" NumeroPaginas="0">
                <titulo>Nombre libro</titulo>
                        <capitulos>
                                <capitulo NumeroCapitulo="0">
                                        <titulo>Nombre capitulo</titulo>
                                        <Contenido enlace="enlace.html"/>
                                </capitulo>
                        </capitulos> 
                <indice/>
                <sinopsis/>
         </libro>          
         <libro id="L2222" Tipo_clase="Infantil" NumeroPaginas="0">
                <titulo>Nombre libro</titulo>
                        <capitulos>
                                <capitulo NumeroCapitulo="0">
                                        <titulo>Nombre capitulo</titulo>
                                        <Contenido enlace="enlace.html"/>
                                </capitulo>
                        </capitulos> 
                <indice/>
                <sinopsis/>
         </libro>          
         <libro id="L3333" Tipo_clase="Didactico" NumeroPaginas="0">
                <titulo>Nombre libro</titulo>
                        <capitulos>
                                <capitulo NumeroCapitulo="0">
                                        <titulo>Nombre capitulo</titulo>
                                        <Contenido enlace="enlace.html"/>
                                </capitulo>
                        </capitulos> 
                <indice/>
                <sinopsis/>
         </libro>          
        </libros>
        <revistas> 
          <revista id="R0001" Tipo_clase="Informatica" NumeroPaginas="0">
                 <titulo>Nombre revista</titulo>
                 <NumeroRevista>0</NumeroRevista>
                 <indice/>
                 <Secciones>
                        <Seccion NumeroPaginas="">
                                <titulo>nombre seccion</titulo> 
                                <Contenido enlace="enlace.html"/>
                        </Seccion>
                 </Secciones>
          </revista>
          <revista id="R0002" Tipo_clase="Corazon" NumeroPaginas="0">
                 <titulo>Nombre revista</titulo>
                 <NumeroRevista>0</NumeroRevista>
                 <indice/>            
                 <Secciones>
                        <Seccion NumeroPaginas="">
                                <titulo>nombre seccion</titulo> 
                                <Contenido enlace="enlace.html"/>
                        </Seccion>
                 </Secciones>
          </revista>
          <revista id="R0003" Tipo_clase="Coches" NumeroPaginas="0">
                 <titulo>Nombre revista</titulo>
                 <NumeroRevista>0</NumeroRevista>
                 <indice/>
                 <Secciones>
                        <Seccion NumeroPaginas="">
                                <titulo>nombre seccion</titulo> 
                                <Contenido enlace="enlace.html"/>
                        </Seccion>
                 </Secciones>
          </revista>
          <revista id="R0004" Tipo_clase="Investigacion" NumeroPaginas="0">
                 <titulo>Nombre revista</titulo>
                 <NumeroRevista>0</NumeroRevista>
                 <indice/>
                 <Secciones>
                        <Seccion NumeroPaginas="">
                                <titulo>nombre seccion</titulo> 
                                <Contenido enlace="enlace.html"/>
                        </Seccion>
                 </Secciones>
          </revista>
          <revista id="R0005" Tipo_clase="Otras" NumeroPaginas="0">
                 <titulo>Nombre revista</titulo>
                 <NumeroRevista>0</NumeroRevista>
                 <indice/>
                 <Secciones>
                        <Seccion NumeroPaginas="">
                                <titulo>nombre seccion</titulo> 
                                <Contenido enlace="enlace.html"/>
                        </Seccion>
                 </Secciones>
          </revista>
        </revistas>   
        <periodicos>
          <periodico id="P4444" Tipo_clase="Nacionales" FechaPublicacion="">
                 <indice/>
                 <secciones>
                 <seccion_periodico tipoSeccion="Economica">
                                <articulos>
                                        <articulo autor="nombreAutor">
                                                <Contenido enlace="enlace.html"/>
                                        </articulo>
                                </articulos>
                 </seccion_periodico> 
                 <seccion_periodico tipoSeccion="Opinion">
                                <articulos>
                                        <articulo autor="nombreAutor">
                                                <Contenido enlace="enlace.html"/>
                                        </articulo>
                                </articulos>
                 </seccion_periodico> 
                 <seccion_periodico tipoSeccion="Deportes">
                                <articulos>
                                        <articulo autor="nombreAutor">
                                                <Contenido enlace="enlace.html"/>
                                        </articulo>
                                </articulos>
                 </seccion_periodico> 
                 <seccion_periodico tipoSeccion="Nacional">
                                <articulos>
                                        <articulo autor="nombreAutor">
                                                <Contenido enlace="enlace.html"/>
                                        </articulo>
                                </articulos>
                 </seccion_periodico> 
                 <seccion_periodico tipoSeccion="Internacional">
                                <articulos>
                                        <articulo autor="nombreAutor">
                                                <Contenido enlace="enlace.html"/>
                                        </articulo>
                                </articulos>
                 </seccion_periodico> 
                 </secciones>
          </periodico>    
          <periodico id="P5555" Tipo_clase="Internacionales" FechaPublicacion="">
                 <indice/>
                 <secciones>
                        <seccion_periodico tipoSeccion="Economica">
                                <articulos>
                                        <articulo autor="nombreAutor">
                                                <Contenido enlace="enlace.html"/>
                                        </articulo>
                                </articulos>
                        </seccion_periodico> 
                        <seccion_periodico tipoSeccion="Opinion">
                                <articulos>
                                        <articulo autor="nombreAutor">
                                                <Contenido enlace="enlace.html"/>
                                        </articulo>
                                </articulos>
                        </seccion_periodico> 
                        <seccion_periodico tipoSeccion="Deportes">
                                <articulos>
                                        <articulo autor="nombreAutor">
                                                <Contenido enlace="enlace.html"/>
                                        </articulo>
                                </articulos>
                        </seccion_periodico> 
                        <seccion_periodico tipoSeccion="Nacional">
                                <articulos>
                                        <articulo autor="nombreAutor">
                                                <Contenido enlace="enlace.html"/>
                                        </articulo>
                                </articulos>
                        </seccion_periodico> 
                        <seccion_periodico tipoSeccion="Internacional">
                                <articulos>
                                        <articulo autor="nombreAutor">
                                                <Contenido enlace="enlace.html"/>
                                        </articulo>
                                </articulos>
                        </seccion_periodico> 
                </secciones>
         </periodico>               
        </periodicos>   
</biblioteca>                